school discipline problems,Primary school,Middle school,High school
Student racial/ethnic tensions,1.9%,4.9%,4.5%
Student bullying,8.7%,27.9%,15.8%
Sexual harassment of other students,-,3.3%,2.8%
Student harassment of other students based on sexual orientation or gender identity,-,2.6%,2.3%
Student verbal abuse of teachers,4.6%,10.3%,7.1%
Student acts of disrespect for teachers other than verbal abuse,10.1%,17.3%,13.1%
Widespread disorder in classroom,2.6%,5.5%,2.6%
Gang activities,4.9%,19%,27.9%
