Location,Millennials (18-37),Gen X (38-49),Baby Boomers (50-68),Matures (69+)
"A chain drug store (e.g., Walgreens, CVS, Eckerd)",41%,36%,24%,24%
"The pharmacy at a discount store (e.g., Wal-Mart, Target, Sam's Club)",17%,17%,18%,14%
Online or by mail order,3%,13%,21%,26%
"The pharmacy at a supermarket (e.g., Safeway, Shop Rite or Kroger)",11%,11%,11%,12%
A local independent pharmacy,4%,7%,9%,10%
The pharmacy at a hospital or medical center,3%,5%,6%,6%
Somewhere else,3%,1%,2%,3%
Never purchase prescription drugs,18%,9%,8%,4%
