Response,Total,Men,Women
Being able to count on one another when someone needs something,86%,78%,93%
Being friends,84%,78%,90%
Sharing memories and family history,83%,75%,90%
Communicating frequently,82%,75%,89%
"Staying up-to-date on important events like weddings, deaths, graduations, births, etc.",81%,72%,89%
Having close personal relationships,81%,74%,87%
Spending holidays or special occasions together,79%,72%,85%
Spending time together on a regular basis,74%,68%,79%
Taking vacations together,40%,37%,43%
