Response,Very easy,Easy,Neither easy nor difficult,Difficult,Very difficult
The application and due diligence process,4%,43%,30%,17%,4%
Developing the crowdfunding pitch,9%,23%,41%,23%,5%
Developing marketing or social media strategy,9%,22%,39%,22%,9%
Communicating with prospective investors,13%,57%,9%,9%,13%
Deciding how much equity to offer,17%,30%,22%,26%,4%
Managing investor relations,23%,50%,9%,14%,5%
Finding the right crowdfunding platform,30%,43%,17%,4%,4%
Working with crowdfunding platform,45%,32%,9%,5%,9%
