Response,"Annual household income of less than 25,000 dollars","Annual household income of more than 55,000 dollars"
Did not fill a prescription for medicine or skipped doses of medications because of the cost,9%,1%
Did not see a doctor for medical problem because of cost,5%,1%
"Skipped a medical test, treatment or follow-up recommended by a doctor because of the cost",7%,1%
Did not see a dentist when needed to because of the cost,27%,8%
Had problems or was unable to pay medical bills in the past 12 months,8%,2%
