Response,Share of respondents
Used at least one social media site for personal use,88%
"Post messages, pictures or videos in social media about employers often or from time to time",50%
Have shared praises or positive comments online about employer,39%
"Post messages, pictures or videos in social media about employer without encouragement from employer",33%
Have shared criticism or negative comments online about employer,16%
Have posted something about employer in social media that they wish they hadn't,14%
